{
  "$schema": "https://json-schema.org/draft/2020-12/schema",
  "$id": "ForeignProject",
  "$ref": "#/definitions/ForeignProject",
  "definitions": {
    "ForeignProject": {
      "type": "object",
      "additionalProperties": false,
      "properties": {
        "_uuid": {
          "type": "string"
        },
        "_type": {
          "const": "UvpForeignProjectDoc"
        },
        "title": {
          "type": "string"
        },
        "description": {
          "type": "string"
        },
        "pointOfContact": {
          "type": "array",
          "items": {
            "$ref": "refs/general.schema.json#/definitions/PointOfContact"
          },
          "minItems": 1,
          "maxItems": 1
        },
        "spatial": {
          "type": "array",
          "items": {
            "$ref": "../../general.schema.json#/definitions/Spatial"
          },
          "minItems": 1,
          "maxItems": 1
        },
        "processingSteps": {
          "type": "array",
          "items": {
            "$ref": "refs/processing-steps-foreign-projects.schema.json"
          }
        }
      },
      "required": [
        "_uuid",
        "_type",
        "title",
        "description",
        "pointOfContact",
        "spatial"
      ],
      "title": "ForeignProject"
    }
  }
}
